<?xml version="1.0" encoding="UTF-8"?>
<!--
Licensed under the Apache License, Version 2.0 (the "License");
you may not use this file except in compliance with the License.
You may obtain a copy of the License at

   http://www.apache.org/licenses/LICENSE-2.0

Unless required by applicable law or agreed to in writing, software
distributed under the License is distributed on an "AS IS" BASIS,
WITHOUT WARRANTIES OR CONDITIONS OF ANY KIND, either express or implied.
See the License for the specific language governing permissions and
limitations under the License.
-->

<collection xmlns:xsi="http://www.w3.org/2001/XMLSchema-instance" xsi:noNamespaceSchemaLocation="mySchema.xsd">
   <entry>
		<bib>
			<author> University of Strathclyde Glasgow </author>
		    <year>   Retrieved 6/30, 2011   </year>
		    <title>  Pictish Stone Database.  </title>
		    <pubInfo> from http://www.mathstat.strath.ac.uk/outreach/pictish/database.php </pubInfo>
		</bib>
		
		<document type="PictishStone" region="Angus" class="I">
		    <description>Aberlemno 1</description>
		    <docText>
				<line number="1">
					<symbol><title>Serpent</title></symbol>
				</line>
				<line number="2">
					<symbolUnit>
						<symbol><title>Double-Disc</title></symbol>
						<symbol><title>Z</title></symbol>
					</symbolUnit>
				</line>
				<line number="3">
					<symbol><title>Mirror</title></symbol>
					<symbol><title>Comb</title></symbol>
				</line>
		    </docText>
		</document>
		
		<document type="PictishStone" region="Angus" class="II">
		    <description>Aberlemno 2</description>
		    <docText>
				<line number="1">
					<symbolUnit>
						<symbol><title>Divided-Rectangle</title></symbol>
						<symbol><title>Z</title></symbol>
					</symbolUnit>
					<symbol reliability="alternative transcriptions">
						<title>Triple-Disc</title>
						<alternative><symbolUnit>
							<symbol><title>Triple-Disc</title></symbol>
							<symbol><title>Bar</title></symbol>
							<src>PSSH</src>
						</symbolUnit></alternative>
					</symbol>
				</line>
		    </docText>
		</document>
		
		<document type="PictishStone" region="Angus" class="II">
		    <description>Aberlemno 3</description>
		    <docText>
				<line number="1">
					<symbolUnit>
						<symbol><title>Crescent</title></symbol>
						<symbol><title>V</title></symbol>
					</symbolUnit>
				</line>
				<line number="2">
					<symbolUnit>
						<symbol><title>Double-Disc</title></symbol>
						<symbol><title>Z</title></symbol>
					</symbolUnit>
				</line>
				<line number="3">
					<symbol reliability="uncertain"><title>Centaur</title></symbol>
				</line>
		    </docText>
		</document>
		
		<document type="PictishStone" region="Angus" class="IV">
		    <description>Aberlemno 4</description>
		    <docText>
				<line number="1">
					<symbol reliability="uncertain"><title>Crescent</title></symbol>
				</line>
				<line number="2">
					<symbol reliability="alternative transcriptions">
						<title>Beast</title>
						<alternative><title>Curved-Line</title><src>PSSH, RCAHMS</src></alternative>
					</symbol>
				</line>
		    </docText>
		</document>
		
		<document type="PictishStone" region="Angus" class="I">
		    <description>Aberlemno 5, Flemington Farm</description>
		    <docText>
				<line number="1">
					<symbol><title>Horseshoe</title><description>aka Arch</description></symbol>
				</line>
				<line number="2">
					<symbol><title>Beast</title></symbol>
				</line>
		    </docText>
		</document>
		
		<document type="PictishStone" region="Perthshire and Kinross" class="I">
		    <description>Abernethy</description>
		    <docText>
				<line number="1">
					<symbol reliability="uncertain"><title>Hammer</title></symbol>
					<symbol reliability="alternative transcriptions">
						<title>Tuning-Fork</title>
						<description>aka Tongs</description>
						<alternative><title>Notched-Rectangle</title><src>Jackson</src></alternative>
						<alternativesrc>Jackson</alternativesrc>
					</symbol>
					<symbol reliability="uncertain"><title>Anvil</title></symbol>
				</line>
				<line number="2">
					<symbolUnit>
						<symbol><title>Crescent</title></symbol>
						<symbol><title>V</title></symbol>
					</symbolUnit>
				</line>
		    </docText>
		</document>
		
		<document type="PictishStone" region="Highland Caithness" class="I">
		    <description>Ackergill 1, Keiss Bay</description>
		    <docText>
				<line number="1">
					<symbol><title>Salmon</title></symbol>
				</line>
				<line number="2">
					<symbol><title>Rectangle</title></symbol>
				</line>
		    </docText>
		</document>
		
		<document type="PictishStone" region="Highland Caithness" class="I">
		    <description>Ackergill 2</description>
		    <docText>
				<line number="1">
					<symbol reliability="alternative transcriptions">
						<title>Rectangle</title>
						<alternative><title>Nochted-Rectangle</title><src>PSSH, RCAHMS</src></alternative>
					</symbol>
				</line>
		    </docText>
		</document>
		
		<document type="PictishStone" region="Highland Badenoch and Strathspey" class="I">
		    <description>Advie</description>
		    <docText>
				<line number="1">
					<symbolUnit>
						<symbol><title>Crescent</title></symbol>
						<symbol><title>V</title></symbol>
					</symbolUnit>
					<symbol><title>Mirror-Case</title></symbol>
				</line>
		    </docText>
		</document>
		
		<document type="PictishStone" region="Perthshire and Kinross" class="II">
		    <description>Alyth</description>
		    <docText>
				<line number="1">
					<symbolUnit>
						<symbol><title>Double-Disc</title></symbol>
						<symbol><title>Z</title></symbol>
					</symbolUnit>
				</line>
		    </docText>
		</document>
		
		<document type="PictishStone" region="Dumfries and Galloway" class="I">
		    <description>Anwoth, Trusty's Hill</description>
		    <docText>
				<line number="1">
					<symbolUnit>
						<symbol><title>Double-Disc</title></symbol>
						<symbol><title>Z</title></symbol>
					</symbolUnit>
					<symbol reliability="uncertain"><title>Sword</title></symbol>
					<symbol><title>Fish-Monster</title><description>aka Seahorse</description></symbol>
				</line>
		    </docText>
		</document>
		
		<document type="PictishStone" region="Highland Ross and Cromarty" class="IV">
		    <description>Arbirlot</description>
		    <docText>
				<line number="1">
					<symbol reliability="uncertain"><title>Book</title></symbol>
				</line>
		    </docText>
		</document>
		
		<document type="PictishStone" region="Aberdeenshire" class="I">
		    <description>Ardiachie</description>
		    <docText>
				<line number="1">
					<symbol reliability="alternative transcriptions">
						<title>Wheel</title>
						<alternative><title>Spoked-Wheel</title><src>RCAHMS</src></alternative>
					</symbol>
				</line>
				<line number="2">
					<symbol reliability="uncertain"><title>Disc</title></symbol>
				</line>
				<line number="3">
					<symbol reliability="uncertain"><title>Step</title></symbol>
				</line>
		    </docText>
		</document>
		
		<document type="PictishStone" region="Highland Ross and Cromarty" class="I">
		    <description>Ardliar, Kennethmont</description>
		    <docText>
				<line number="1">
					<symbol><title>Beast</title></symbol>
					<symbol reliability="alternative transcriptions">
						<title>Tuning-Fork</title>
						<alternative><title>Broken-Sword</title><src>PSSH</src></alternative>
						<alternative><title>Notched-Rectangle</title><src>Jackson</src></alternative>
					</symbol>
					<symbol><title>Mirror</title></symbol>
				</line>
		    </docText>
		</document>
		
		<document type="PictishStone" region="Highland Ross and Cromarty" class="I">
		    <description>Ardross 1</description>
		    <docText>
				<line number="1">
					<symbol reliability="alternative transcriptions">
						<title>Wolf</title>
						<alternative><title>Bust-of-Deer</title><src>RCAHMS</src></alternative>
					</symbol>
				</line>
		    </docText>
		</document>
		
		<document type="PictishStone" region="Moray" class="I">
		    <description>Ardross 2</description>
		    <docText>
				<line number="1">
					<symbol reliability="alternative transcriptions">
						<title>Deer</title>
						<alternative><title>Dog</title><src>RCAHMS</src></alternative>
						<alternative><title>Wolf</title><src>RCAHMS</src></alternative>
					</symbol>
				</line>
		    </docText>
		</document>
		
		<document type="PictishStone" region="Angus" class="I">
		    <description>Arndilly</description>
		    <docText>
				<line number="1">
					<symbol><title>Mirror-Case</title></symbol>
					<symbolUnit>
						<symbol reliability="alternative transcriptions">
							<title>Notched-Rectangle</title>
							<alternative><title>Divided-Rectange</title><src>Field Guide</src></alternative>
							<alternative><title>Rectangle</title><src>Jakson</src></alternative>
						</symbol>
						<symbol><title>Z</title></symbol>
					</symbolUnit>
				</line>
		    </docText>
		</document>
		
		<document type="PictishStone" region="Angus" class="IV">
		    <description>Baggerton</description>
		    <docText>
				<line number="1">
					<symbolUnit>
						<symbol><title>Serpent</title></symbol>
						<symbol reliability="uncertain"><title>Z</title></symbol>
					</symbolUnit>
					<symbol reliability="uncertain"><title>Sceptre</title></symbol>
				</line>
		    </docText>
		</document>
		
		<document type="PictishStone" region="Highland Inverness" class="IV">
		    <description>Balblair, Monjack, Kilmorack</description>
		    <docText>
				<line number="1">
					<symbolUnit>
						<symbol><title>Man</title></symbol>
						<symbol reliability="alternative transcriptions">
							<title>Cub</title>
							<alternative><title>Sword</title><src>RCAHMS</src></alternative>
						</symbol>
					</symbolUnit>
				</line>
				<line number="2">
					<symbol reliability="uncertain"><title>Cupmarks</title></symbol>
				</line>
		    </docText>
		</document>